Timestamp,User Question,Success Status,Search Queries Attempted,Final Agent Response,Total Run Latency (ms),Stages Executed Summary,Detailed Node Telemetry (JSON)
2026-07-17 09:30:14,"What was Apple's research and development expense for the three months ended December 27, 2025?",SUCCESS,"'What was Apple's research and development expense for the three months ended December 27, 2025?'","Apple's research and development expense for the three months ended December 27, 2025, was $10,887 million [1].",14990,retrieve_chunks [23 tks] (6596ms) -> grade_documents [3837 tks] (7577ms) -> generate_answer [1830 tks] (817ms),"[{""node"": ""retrieve_chunks"", ""latency_ms"": 6596, ""prompt_tokens"": 23, ""completion_tokens"": 0, ""total_tokens"": 23, ""cost"": 4.6e-07}, {""node"": ""grade_documents"", ""latency_ms"": 7577, ""prompt_tokens"": 3650, ""completion_tokens"": 187, ""total_tokens"": 3837, ""cost"": 0.0006597}, {""node"": ""generate_answer"", ""latency_ms"": 817, ""prompt_tokens"": 1802, ""completion_tokens"": 28, ""total_tokens"": 1830, ""cost"": 0.002705}]"
2026-07-17 09:30:23,"What was the total cash, cash equivalents, and restricted cash of Apple at the end of the December 27, 2025 period?",SUCCESS,"'What was the total cash, cash equivalents, and restricted cash of Apple at the end of the December 27, 2025 period?'","The total cash, cash equivalents, and restricted cash of Apple at the end of the December 27, 2025 period was $45,317 million [2].",8541,retrieve_chunks [28 tks] (1144ms) -> grade_documents [3906 tks] (6391ms) -> generate_answer [1695 tks] (1006ms),"[{""node"": ""retrieve_chunks"", ""latency_ms"": 1144, ""prompt_tokens"": 28, ""completion_tokens"": 0, ""total_tokens"": 28, ""cost"": 5.6e-07}, {""node"": ""grade_documents"", ""latency_ms"": 6391, ""prompt_tokens"": 3696, ""completion_tokens"": 210, ""total_tokens"": 3906, ""cost"": 0.0006804}, {""node"": ""generate_answer"", ""latency_ms"": 1006, ""prompt_tokens"": 1661, ""completion_tokens"": 34, ""total_tokens"": 1695, ""cost"": 0.0025725}]"
2026-07-17 09:30:37,"What was Apple's total net sales for the fiscal year ended September 27, 2025?",SUCCESS,"'What was Apple's total net sales for the fiscal year ended September 27, 2025?'","Apple's total net sales for the fiscal year ended September 27, 2025, were $416,161 million. [1]",12924,retrieve_chunks [19 tks] (1185ms) -> grade_documents [3579 tks] (9837ms) -> generate_answer [1549 tks] (1902ms),"[{""node"": ""retrieve_chunks"", ""latency_ms"": 1185, ""prompt_tokens"": 19, ""completion_tokens"": 0, ""total_tokens"": 19, ""cost"": 3.8e-07}, {""node"": ""grade_documents"", ""latency_ms"": 9837, ""prompt_tokens"": 3384, ""completion_tokens"": 195, ""total_tokens"": 3579, ""cost"": 0.0006245999999999999}, {""node"": ""generate_answer"", ""latency_ms"": 1902, ""prompt_tokens"": 1521, ""completion_tokens"": 28, ""total_tokens"": 1549, ""cost"": 0.0040825}]"
2026-07-17 09:30:47,"How many shares of common stock did Apple have outstanding as of October 17, 2025?",SUCCESS,"'How many shares of common stock did Apple have outstanding as of October 17, 2025?'","As of October 17, 2025, Apple had 14,773,260 thousand shares of common stock outstanding. [1]",8753,retrieve_chunks [20 tks] (1266ms) -> grade_documents [3514 tks] (6821ms) -> generate_answer [803 tks] (666ms),"[{""node"": ""retrieve_chunks"", ""latency_ms"": 1266, ""prompt_tokens"": 20, ""completion_tokens"": 0, ""total_tokens"": 20, ""cost"": 4.0000000000000003e-07}, {""node"": ""grade_documents"", ""latency_ms"": 6821, ""prompt_tokens"": 3307, ""completion_tokens"": 207, ""total_tokens"": 3514, ""cost"": 0.0006202499999999999}, {""node"": ""generate_answer"", ""latency_ms"": 666, ""prompt_tokens"": 775, ""completion_tokens"": 28, ""total_tokens"": 803, ""cost"": 0.0022175000000000003}]"
2026-07-17 09:30:56,"What was Microsoft's Productivity and Business Processes revenue for the three months ended December 31, 2025?",SUCCESS,"'What was Microsoft's Productivity and Business Processes revenue for the three months ended December 31, 2025?'","Microsoft's Productivity and Business Processes revenue for the three months ended December 31, 2025, was $50,567 million. [4]",8520,retrieve_chunks [27 tks] (1111ms) -> grade_documents [3807 tks] (6659ms) -> generate_answer [2018 tks] (750ms),"[{""node"": ""retrieve_chunks"", ""latency_ms"": 1111, ""prompt_tokens"": 27, ""completion_tokens"": 0, ""total_tokens"": 27, ""cost"": 5.4e-07}, {""node"": ""grade_documents"", ""latency_ms"": 6659, ""prompt_tokens"": 3583, ""completion_tokens"": 224, ""total_tokens"": 3807, ""cost"": 0.00067185}, {""node"": ""generate_answer"", ""latency_ms"": 750, ""prompt_tokens"": 1988, ""completion_tokens"": 30, ""total_tokens"": 2018, ""cost"": 0.00303}]"
2026-07-17 09:31:06,"What was the cash flow from operations for Microsoft during the six months ended December 31, 2025?",SUCCESS,"'What was the cash flow from operations for Microsoft during the six months ended December 31, 2025?'","The cash flow from operations for Microsoft during the six months ended December 31, 2025, can be calculated by summing the operating cash flows from operating leases and finance leases. According to the provided data:  - Operating cash flows from operating leases: $3,161 million - Operating cash flows from finance leases: $1,161 million  Therefore, the total cash flow from operations is $3,161 million + $1,161 million = $4,322 million.   This calculation is based on the supplemental cash flow information related to leases provided in the document [2].",9045,retrieve_chunks [24 tks] (1228ms) -> grade_documents [3238 tks] (5630ms) -> generate_answer [944 tks] (2187ms),"[{""node"": ""retrieve_chunks"", ""latency_ms"": 1228, ""prompt_tokens"": 24, ""completion_tokens"": 0, ""total_tokens"": 24, ""cost"": 4.800000000000001e-07}, {""node"": ""grade_documents"", ""latency_ms"": 5630, ""prompt_tokens"": 3062, ""completion_tokens"": 176, ""total_tokens"": 3238, ""cost"": 0.0005648999999999999}, {""node"": ""generate_answer"", ""latency_ms"": 2187, ""prompt_tokens"": 825, ""completion_tokens"": 119, ""total_tokens"": 944, ""cost"": 0.0032525}]"
2026-07-17 09:31:20,"What was Microsoft's total cost of revenue for the fiscal year ended June 30, 2025?",SUCCESS,"'What was Microsoft's total cost of revenue for the fiscal year ended June 30, 2025?'","To determine Microsoft's total cost of revenue for the fiscal year ended June 30, 2025, we need to consider the revenue and the gross margin information provided. The total revenue for fiscal year 2025 was $281.724 billion [1]. The gross margin increased by $22.9 billion or 13% [3], but the gross margin percentage decreased slightly due to the impact of scaling AI infrastructure [3].  The cost of revenue increased by $13.7 billion or 19% [3]. However, the exact total cost of revenue is not directly provided in the text. To find it, we would typically subtract the gross margin from the total revenue. Unfortunately, the exact gross margin figure is not provided, only the increase and percentage change.  Therefore, based on the information provided, we cannot calculate the exact total cost of revenue for fiscal year 2025 without additional data on the gross margin or the previous year's cost of revenue.",12439,retrieve_chunks [20 tks] (1337ms) -> grade_documents [3408 tks] (5979ms) -> generate_answer [1304 tks] (5123ms),"[{""node"": ""retrieve_chunks"", ""latency_ms"": 1337, ""prompt_tokens"": 20, ""completion_tokens"": 0, ""total_tokens"": 20, ""cost"": 4.0000000000000003e-07}, {""node"": ""grade_documents"", ""latency_ms"": 5979, ""prompt_tokens"": 3210, ""completion_tokens"": 198, ""total_tokens"": 3408, ""cost"": 0.0006002999999999999}, {""node"": ""generate_answer"", ""latency_ms"": 5123, ""prompt_tokens"": 1112, ""completion_tokens"": 192, ""total_tokens"": 1304, ""cost"": 0.0047}]"
2026-07-17 09:31:38,"How much did Microsoft spend on stock-based compensation expense for the fiscal year ended June 30, 2025?",SUCCESS,"'How much did Microsoft spend on stock-based compensation expense for the fiscal year ended June 30, 2025?'","Microsoft spent $11,974 million on stock-based compensation expense for the fiscal year ended June 30, 2025 [2].",17506,retrieve_chunks [26 tks] (1296ms) -> grade_documents [3467 tks] (15596ms) -> generate_answer [854 tks] (614ms),"[{""node"": ""retrieve_chunks"", ""latency_ms"": 1296, ""prompt_tokens"": 26, ""completion_tokens"": 0, ""total_tokens"": 26, ""cost"": 5.2e-07}, {""node"": ""grade_documents"", ""latency_ms"": 15596, ""prompt_tokens"": 3279, ""completion_tokens"": 188, ""total_tokens"": 3467, ""cost"": 0.00060465}, {""node"": ""generate_answer"", ""latency_ms"": 614, ""prompt_tokens"": 827, ""completion_tokens"": 27, ""total_tokens"": 854, ""cost"": 0.0023374999999999997}]"
2026-07-17 09:32:18,"What was Google's net income for the period ending December 31, 2025?",FAILED/UNSUPPORTED,"'What was Google's net income for the period ending December 31, 2025?'","I searched the provided financial documents multiple times using alternative keywords, but I could not find any relevant information to reliably answer your question.",38251,retrieve_chunks [17 tks] (1051ms) -> grade_documents [3606 tks] (14004ms) -> rewrite_query [160 tks] (746ms) -> retrieve_chunks [13 tks] (1448ms) -> grade_documents [3899 tks] (12418ms) -> rewrite_query [160 tks] (914ms) -> retrieve_chunks [13 tks] (1083ms) -> grade_documents [3899 tks] (6587ms) -> generate_answer_empty (0ms),"[{""node"": ""retrieve_chunks"", ""latency_ms"": 1051, ""prompt_tokens"": 17, ""completion_tokens"": 0, ""total_tokens"": 17, ""cost"": 3.4000000000000003e-07}, {""node"": ""grade_documents"", ""latency_ms"": 14004, ""prompt_tokens"": 3444, ""completion_tokens"": 162, ""total_tokens"": 3606, ""cost"": 0.0006137999999999998}, {""node"": ""rewrite_query"", ""latency_ms"": 746, ""prompt_tokens"": 149, ""completion_tokens"": 11, ""total_tokens"": 160, ""cost"": 2.8949999999999996e-05}, {""node"": ""retrieve_chunks"", ""latency_ms"": 1448, ""prompt_tokens"": 13, ""completion_tokens"": 0, ""total_tokens"": 13, ""cost"": 2.6e-07}, {""node"": ""grade_documents"", ""latency_ms"": 12418, ""prompt_tokens"": 3722, ""completion_tokens"": 177, ""total_tokens"": 3899, ""cost"": 0.0006644999999999999}, {""node"": ""rewrite_query"", ""latency_ms"": 914, ""prompt_tokens"": 149, ""completion_tokens"": 11, ""total_tokens"": 160, ""cost"": 2.8949999999999996e-05}, {""node"": ""retrieve_chunks"", ""latency_ms"": 1083, ""prompt_tokens"": 13, ""completion_tokens"": 0, ""total_tokens"": 13, ""cost"": 2.6e-07}, {""node"": ""grade_documents"", ""latency_ms"": 6587, ""prompt_tokens"": 3722, ""completion_tokens"": 177, ""total_tokens"": 3899, ""cost"": 0.0005877}, {""node"": ""generate_answer_empty"", ""latency_ms"": 0, ""prompt_tokens"": 0, ""completion_tokens"": 0, ""total_tokens"": 0, ""cost"": 0.0}]"
2026-07-17 09:32:28,Compare Apple's net sales directly with the current market capitalization of NVIDIA.,SUCCESS,'Compare Apple's net sales directly with the current market capitalization of NVIDIA.',"To compare Apple's net sales with NVIDIA's market capitalization, we need to look at the figures provided for Apple's net sales and find the current market capitalization of NVIDIA.  From the provided context, Apple's net sales for 2024 are $391,035 million (or $391.035 billion) [1].  To complete the comparison, we would need NVIDIA's current market capitalization, which is not provided in the context. However, as of the latest available data, NVIDIA's market capitalization can be found on financial news websites or stock market platforms. If you have access to such a source, you can directly compare it with Apple's net sales figure of $391.035 billion.",8931,retrieve_chunks [21 tks] (1082ms) -> grade_documents [3909 tks] (5794ms) -> generate_answer [811 tks] (2055ms),"[{""node"": ""retrieve_chunks"", ""latency_ms"": 1082, ""prompt_tokens"": 21, ""completion_tokens"": 0, ""total_tokens"": 21, ""cost"": 4.2e-07}, {""node"": ""grade_documents"", ""latency_ms"": 5794, ""prompt_tokens"": 3729, ""completion_tokens"": 180, ""total_tokens"": 3909, ""cost"": 0.0006673499999999999}, {""node"": ""generate_answer"", ""latency_ms"": 2055, ""prompt_tokens"": 677, ""completion_tokens"": 134, ""total_tokens"": 811, ""cost"": 0.0030325000000000005}]"
2026-07-17 09:32:40,"What was Apple's total share-based compensation expense and its related income tax benefit for the three months ended December 27, 2025?",SUCCESS,"'What was Apple's total share-based compensation expense and its related income tax benefit for the three months ended December 27, 2025?'","The provided context does not specify Apple's total share-based compensation expense and its related income tax benefit for the three months ended December 27, 2025. The data available only covers annual figures for 2025, 2024, and 2023. For 2025, the annual share-based compensation expense was $12,863 million, and the related income tax benefit was $(3,602) million [1]. To determine the figures for the specific three-month period, additional quarterly data would be required.",11133,retrieve_chunks [34 tks] (1035ms) -> grade_documents [3304 tks] (8650ms) -> generate_answer [530 tks] (1448ms),"[{""node"": ""retrieve_chunks"", ""latency_ms"": 1035, ""prompt_tokens"": 34, ""completion_tokens"": 0, ""total_tokens"": 34, ""cost"": 6.800000000000001e-07}, {""node"": ""grade_documents"", ""latency_ms"": 8650, ""prompt_tokens"": 3123, ""completion_tokens"": 181, ""total_tokens"": 3304, ""cost"": 0.00057705}, {""node"": ""generate_answer"", ""latency_ms"": 1448, ""prompt_tokens"": 426, ""completion_tokens"": 104, ""total_tokens"": 530, ""cost"": 0.002105}]"
2026-07-17 09:32:49,"What was Apple's cost of sales for Products versus Services for the three months ended December 27, 2025?",SUCCESS,"'What was Apple's cost of sales for Products versus Services for the three months ended December 27, 2025?'","For the three months ended December 27, 2025, Apple's cost of sales for Products was $67,478 million, and for Services, it was $7,047 million [3].",7774,retrieve_chunks [26 tks] (1170ms) -> grade_documents [3628 tks] (6010ms) -> generate_answer [1329 tks] (594ms),"[{""node"": ""retrieve_chunks"", ""latency_ms"": 1170, ""prompt_tokens"": 26, ""completion_tokens"": 0, ""total_tokens"": 26, ""cost"": 5.2e-07}, {""node"": ""grade_documents"", ""latency_ms"": 6010, ""prompt_tokens"": 3420, ""completion_tokens"": 208, ""total_tokens"": 3628, ""cost"": 0.0006377999999999999}, {""node"": ""generate_answer"", ""latency_ms"": 594, ""prompt_tokens"": 1289, ""completion_tokens"": 40, ""total_tokens"": 1329, ""cost"": 0.0020225}]"
2026-07-17 09:33:02,"As of December 27, 2025, what was Apple's total unrecognized compensation cost related to outstanding restricted stock units (RSUs)?",SUCCESS,"'As of December 27, 2025, what was Apple's total unrecognized compensation cost related to outstanding restricted stock units (RSUs)?'","As of December 27, 2025, Apple's total unrecognized compensation cost related to outstanding restricted stock units (RSUs) was $21.8 billion. This amount is expected to be recognized over a weighted-average period of 2.5 years [1].",12140,retrieve_chunks [33 tks] (1068ms) -> grade_documents [3584 tks] (7044ms) -> generate_answer [1376 tks] (4028ms),"[{""node"": ""retrieve_chunks"", ""latency_ms"": 1068, ""prompt_tokens"": 33, ""completion_tokens"": 0, ""total_tokens"": 33, ""cost"": 6.6e-07}, {""node"": ""grade_documents"", ""latency_ms"": 7044, ""prompt_tokens"": 3348, ""completion_tokens"": 236, ""total_tokens"": 3584, ""cost"": 0.0006437999999999999}, {""node"": ""generate_answer"", ""latency_ms"": 4028, ""prompt_tokens"": 1322, ""completion_tokens"": 54, ""total_tokens"": 1376, ""cost"": 0.002405}]"
2026-07-17 09:33:13,"What was Apple's total annual spend on Research and Development (R&D) for the fiscal year ended September 27, 2025?",SUCCESS,"'What was Apple's total annual spend on Research and Development (R&D) for the fiscal year ended September 27, 2025?'","Apple's total annual spend on Research and Development (R&D) for the fiscal year ended September 27, 2025, was $31,370 million. [1]",10580,retrieve_chunks [28 tks] (1283ms) -> grade_documents [3830 tks] (7767ms) -> generate_answer [727 tks] (1530ms),"[{""node"": ""retrieve_chunks"", ""latency_ms"": 1283, ""prompt_tokens"": 28, ""completion_tokens"": 0, ""total_tokens"": 28, ""cost"": 5.6e-07}, {""node"": ""grade_documents"", ""latency_ms"": 7767, ""prompt_tokens"": 3601, ""completion_tokens"": 229, ""total_tokens"": 3830, ""cost"": 0.00067755}, {""node"": ""generate_answer"", ""latency_ms"": 1530, ""prompt_tokens"": 691, ""completion_tokens"": 36, ""total_tokens"": 727, ""cost"": 0.0020875}]"
2026-07-17 09:33:29,"What was Microsoft's quarterly Cloud revenue and its year-over-year constant currency growth rate for the quarter ended June 30, 2025?",SUCCESS,"'What was Microsoft's quarterly Cloud revenue and its year-over-year constant currency growth rate for the quarter ended June 30, 2025?'","For the quarter ended June 30, 2025, Microsoft's Cloud revenue was $51.5 billion, representing a 26% increase compared to the same quarter in the previous fiscal year [1].",14419,retrieve_chunks [33 tks] (2375ms) -> grade_documents [2979 tks] (11061ms) -> generate_answer [1236 tks] (983ms),"[{""node"": ""retrieve_chunks"", ""latency_ms"": 2375, ""prompt_tokens"": 33, ""completion_tokens"": 0, ""total_tokens"": 33, ""cost"": 6.6e-07}, {""node"": ""grade_documents"", ""latency_ms"": 11061, ""prompt_tokens"": 2814, ""completion_tokens"": 165, ""total_tokens"": 2979, ""cost"": 0.0005210999999999999}, {""node"": ""generate_answer"", ""latency_ms"": 983, ""prompt_tokens"": 1195, ""completion_tokens"": 41, ""total_tokens"": 1236, ""cost"": 0.0021175000000000005}]"
2026-07-17 09:33:39,"What was the total purchase price allocated to the acquisition of Activision Blizzard, and how much goodwill was assigned to Microsoft's More Personal Computing segment from it?",SUCCESS,"'What was the total purchase price allocated to the acquisition of Activision Blizzard, and how much goodwill was assigned to Microsoft's More Personal Computing segment from it?'",The total purchase price allocated to the acquisition of Activision Blizzard was $75.4 billion. The goodwill assigned to Microsoft's More Personal Computing segment from this acquisition was $51.001 billion [1][2].,8591,retrieve_chunks [44 tks] (1350ms) -> grade_documents [3474 tks] (6378ms) -> generate_answer [1547 tks] (863ms),"[{""node"": ""retrieve_chunks"", ""latency_ms"": 1350, ""prompt_tokens"": 44, ""completion_tokens"": 0, ""total_tokens"": 44, ""cost"": 8.8e-07}, {""node"": ""grade_documents"", ""latency_ms"": 6378, ""prompt_tokens"": 3255, ""completion_tokens"": 219, ""total_tokens"": 3474, ""cost"": 0.0006196499999999999}, {""node"": ""generate_answer"", ""latency_ms"": 863, ""prompt_tokens"": 1505, ""completion_tokens"": 42, ""total_tokens"": 1547, ""cost"": 0.0041825}]"
2026-07-17 09:33:47,"How many shares of common stock did Microsoft have outstanding as of July 24, 2025?",SUCCESS,"'How many shares of common stock did Microsoft have outstanding as of July 24, 2025?'","As of July 24, 2025, Microsoft had 7,433,166,379 shares of common stock outstanding. [1]",7557,retrieve_chunks [20 tks] (1201ms) -> grade_documents [3251 tks] (5741ms) -> generate_answer [841 tks] (615ms),"[{""node"": ""retrieve_chunks"", ""latency_ms"": 1201, ""prompt_tokens"": 20, ""completion_tokens"": 0, ""total_tokens"": 20, ""cost"": 4.0000000000000003e-07}, {""node"": ""grade_documents"", ""latency_ms"": 5741, ""prompt_tokens"": 3049, ""completion_tokens"": 202, ""total_tokens"": 3251, ""cost"": 0.0005785499999999999}, {""node"": ""generate_answer"", ""latency_ms"": 615, ""prompt_tokens"": 812, ""completion_tokens"": 29, ""total_tokens"": 841, ""cost"": 0.00232}]"
2026-07-17 09:33:59,"What was Microsoft's Productivity and Business Processes segment revenue for the quarter ended June 30, 2025?",SUCCESS,"'What was Microsoft's Productivity and Business Processes segment revenue for the quarter ended June 30, 2025?'","Microsoft's Productivity and Business Processes segment revenue for the quarter ended June 30, 2025, was $50,567 million. [5]",11040,retrieve_chunks [27 tks] (1202ms) -> grade_documents [3720 tks] (8170ms) -> generate_answer [1976 tks] (1668ms),"[{""node"": ""retrieve_chunks"", ""latency_ms"": 1202, ""prompt_tokens"": 27, ""completion_tokens"": 0, ""total_tokens"": 27, ""cost"": 5.4e-07}, {""node"": ""grade_documents"", ""latency_ms"": 8170, ""prompt_tokens"": 3541, ""completion_tokens"": 179, ""total_tokens"": 3720, ""cost"": 0.00063855}, {""node"": ""generate_answer"", ""latency_ms"": 1668, ""prompt_tokens"": 1946, ""completion_tokens"": 30, ""total_tokens"": 1976, ""cost"": 0.002925}]"
2026-07-17 09:34:21,"What was Tesla's total capital expenditure for Gigafactory expansions in the fiscal year ended December 31, 2025?",FAILED/UNSUPPORTED,"'What was Tesla's total capital expenditure for Gigafactory expansions in the fiscal year ended December 31, 2025?'","I searched the provided financial documents multiple times using alternative keywords, but I could not find any relevant information to reliably answer your question.",20962,retrieve_chunks [28 tks] (1394ms) -> grade_documents [3333 tks] (5388ms) -> rewrite_query [171 tks] (640ms) -> retrieve_chunks [19 tks] (1315ms) -> grade_documents [3266 tks] (5829ms) -> rewrite_query [171 tks] (618ms) -> retrieve_chunks [19 tks] (1023ms) -> grade_documents [3266 tks] (4755ms) -> generate_answer_empty (0ms),"[{""node"": ""retrieve_chunks"", ""latency_ms"": 1394, ""prompt_tokens"": 28, ""completion_tokens"": 0, ""total_tokens"": 28, ""cost"": 5.6e-07}, {""node"": ""grade_documents"", ""latency_ms"": 5388, ""prompt_tokens"": 3182, ""completion_tokens"": 151, ""total_tokens"": 3333, ""cost"": 0.0005678999999999999}, {""node"": ""rewrite_query"", ""latency_ms"": 640, ""prompt_tokens"": 157, ""completion_tokens"": 14, ""total_tokens"": 171, ""cost"": 3.195e-05}, {""node"": ""retrieve_chunks"", ""latency_ms"": 1315, ""prompt_tokens"": 19, ""completion_tokens"": 0, ""total_tokens"": 19, ""cost"": 3.8e-07}, {""node"": ""grade_documents"", ""latency_ms"": 5829, ""prompt_tokens"": 3119, ""completion_tokens"": 147, ""total_tokens"": 3266, ""cost"": 0.00055605}, {""node"": ""rewrite_query"", ""latency_ms"": 618, ""prompt_tokens"": 157, ""completion_tokens"": 14, ""total_tokens"": 171, ""cost"": 3.195e-05}, {""node"": ""retrieve_chunks"", ""latency_ms"": 1023, ""prompt_tokens"": 19, ""completion_tokens"": 0, ""total_tokens"": 19, ""cost"": 3.8e-07}, {""node"": ""grade_documents"", ""latency_ms"": 4755, ""prompt_tokens"": 3119, ""completion_tokens"": 147, ""total_tokens"": 3266, ""cost"": 0.00055605}, {""node"": ""generate_answer_empty"", ""latency_ms"": 0, ""prompt_tokens"": 0, ""completion_tokens"": 0, ""total_tokens"": 0, ""cost"": 0.0}]"
2026-07-17 09:34:47,"Provide the total research and development expenses for Microsoft for the three months ended December 31, 1999.",FAILED/UNSUPPORTED,"'Provide the total research and development expenses for Microsoft for the three months ended December 31, 1999.'","I searched the provided financial documents multiple times using alternative keywords, but I could not find any relevant information to reliably answer your question.",24553,retrieve_chunks [27 tks] (1000ms) -> grade_documents [3386 tks] (9188ms) -> rewrite_query [174 tks] (816ms) -> retrieve_chunks [15 tks] (1065ms) -> grade_documents [3144 tks] (5194ms) -> rewrite_query [168 tks] (905ms) -> retrieve_chunks [15 tks] (1047ms) -> grade_documents [3292 tks] (5338ms) -> generate_answer_empty (0ms),"[{""node"": ""retrieve_chunks"", ""latency_ms"": 1000, ""prompt_tokens"": 27, ""completion_tokens"": 0, ""total_tokens"": 27, ""cost"": 5.4e-07}, {""node"": ""grade_documents"", ""latency_ms"": 9188, ""prompt_tokens"": 3182, ""completion_tokens"": 204, ""total_tokens"": 3386, ""cost"": 0.0005996999999999999}, {""node"": ""rewrite_query"", ""latency_ms"": 816, ""prompt_tokens"": 154, ""completion_tokens"": 20, ""total_tokens"": 174, ""cost"": 3.51e-05}, {""node"": ""retrieve_chunks"", ""latency_ms"": 1065, ""prompt_tokens"": 15, ""completion_tokens"": 0, ""total_tokens"": 15, ""cost"": 3.0000000000000004e-07}, {""node"": ""grade_documents"", ""latency_ms"": 5194, ""prompt_tokens"": 2967, ""completion_tokens"": 177, ""total_tokens"": 3144, ""cost"": 0.0005512499999999999}, {""node"": ""rewrite_query"", ""latency_ms"": 905, ""prompt_tokens"": 154, ""completion_tokens"": 14, ""total_tokens"": 168, ""cost"": 3.15e-05}, {""node"": ""retrieve_chunks"", ""latency_ms"": 1047, ""prompt_tokens"": 15, ""completion_tokens"": 0, ""total_tokens"": 15, ""cost"": 3.0000000000000004e-07}, {""node"": ""grade_documents"", ""latency_ms"": 5338, ""prompt_tokens"": 3114, ""completion_tokens"": 178, ""total_tokens"": 3292, ""cost"": 0.0005739}, {""node"": ""generate_answer_empty"", ""latency_ms"": 0, ""prompt_tokens"": 0, ""completion_tokens"": 0, ""total_tokens"": 0, ""cost"": 0.0}]"
